{
  "$schema": "https://json-schema.org/draft/2020-12/schema",
  "$id": "https://github.com/Cloud-Harbor-Consulting-LLC/rejewski/schemas/replay-log/v0.3.json",
  "title": "Rejewski Replay Log Entry",
  "description": "Schema-validated replay-log entry for Rejewski tool runs. v0.3 narrows the response object per kind via if/then/else (graph_call carries pagination + row counters; token_event carries AADSTS + cache + correlation metadata). additionalProperties is enforced inside each per-kind response shape.",
  "type": "object",
  "additionalProperties": false,
  "required": [
    "schema_version",
    "kind",
    "entry_id",
    "tool",
    "technique",
    "tenant_id",
    "borrowed_client_id",
    "actor_upn",
    "started_at_utc",
    "completed_at_utc",
    "request",
    "response",
    "outcome"
  ],
  "properties": {
    "schema_version": {
      "type": "string",
      "const": "0.3"
    },
    "kind": {
      "type": "string",
      "enum": ["graph_call", "token_event"],
      "description": "Discriminator for the response shape. v0.3 narrows the response object per kind via the top-level allOf if/then below."
    },
    "entry_id": {
      "type": "string",
      "format": "uuid"
    },
    "tool": {
      "type": "string",
      "minLength": 1
    },
    "technique": {
      "type": "object",
      "additionalProperties": false,
      "required": ["id", "name"],
      "properties": {
        "id": {
          "type": "string",
          "pattern": "^T[0-9]{4}(\\.[0-9]{3})?$"
        },
        "name": {
          "type": "string",
          "minLength": 1
        }
      }
    },
    "tenant_id": {
      "type": "string",
      "format": "uuid"
    },
    "borrowed_client_id": {
      "type": "string",
      "format": "uuid"
    },
    "actor_upn": {
      "type": "string",
      "format": "email"
    },
    "started_at_utc": {
      "type": "string",
      "format": "date-time"
    },
    "completed_at_utc": {
      "type": "string",
      "format": "date-time"
    },
    "request": {
      "type": "object",
      "additionalProperties": true,
      "required": ["method", "url"],
      "properties": {
        "method": {
          "type": "string",
          "enum": ["GET", "POST", "PUT", "PATCH", "DELETE", "HEAD"]
        },
        "url": {
          "type": "string",
          "minLength": 1
        }
      }
    },
    "response": {
      "type": "object"
    },
    "outcome": {
      "type": "string",
      "enum": ["success", "error", "throttled", "row_cap_hit"]
    },
    "error": {
      "type": "object",
      "additionalProperties": false,
      "required": ["type", "message"],
      "properties": {
        "type": {
          "type": "string",
          "minLength": 1
        },
        "message": {
          "type": "string"
        },
        "status_code": {
          "type": "integer",
          "minimum": 0
        }
      }
    }
  },
  "allOf": [
    {
      "if": {
        "properties": { "kind": { "const": "graph_call" } },
        "required": ["kind"]
      },
      "then": {
        "properties": {
          "response": {
            "type": "object",
            "additionalProperties": false,
            "required": ["status_code", "page_count", "row_count"],
            "properties": {
              "status_code": { "type": "integer", "minimum": 0 },
              "page_count": { "type": "integer", "minimum": 0 },
              "row_count": { "type": "integer", "minimum": 0 },
              "row_cap": { "type": "integer", "minimum": 0 },
              "row_cap_hit": { "type": "boolean" },
              "retry_count": { "type": "integer", "minimum": 0 }
            }
          }
        }
      }
    },
    {
      "if": {
        "properties": { "kind": { "const": "token_event" } },
        "required": ["kind"]
      },
      "then": {
        "properties": {
          "response": {
            "type": "object",
            "additionalProperties": false,
            "required": ["status_code"],
            "properties": {
              "status_code": { "type": "integer", "minimum": 0 },
              "aadsts_code": {
                "type": ["string", "null"]
              },
              "correlation_id": {
                "type": ["string", "null"]
              },
              "persistence_kind": {
                "type": "string",
                "enum": ["encrypted", "plaintext"]
              },
              "cache_path": {
                "type": "string",
                "minLength": 1
              },
              "flow": {
                "type": "string",
                "enum": ["silent", "ropc"]
              }
            }
          }
        }
      }
    }
  ]
}