{
  "schema_version": "0.3",
  "entry_id": "d2359cc0-f634-4be1-84af-1533d47216dc",
  "kind": "graph_call",
  "tool": "tool_list_users",
  "technique": {
    "id": "T1087.004",
    "name": "Account Discovery: Cloud Account"
  },
  "tenant_id": "76b87c33-6178-4ff9-94a7-164792c8e4c6",
  "borrowed_client_id": "14d82eec-204b-4c2f-b7e8-296a70dab67e",
  "actor_upn": "meganb@cloudharbor-demo.com",
  "started_at_utc": "2026-05-15T22:14:33Z",
  "completed_at_utc": "2026-05-15T22:14:34Z",
  "request": {
    "method": "GET",
    "url": "https://graph.microsoft.com/v1.0/users",
    "headers": {
      "User-Agent": "rejewski-tool-list-users/0.1",
      "Content-Type": "application/json"
    },
    "query": {
      "$select": "id,userPrincipalName,displayName,accountEnabled,userType",
      "$top": "999"
    }
  },
  "response": {
    "status_code": 200,
    "page_count": 1,
    "row_count": 6,
    "row_cap": 1000,
    "row_cap_hit": false,
    "retry_count": 0
  },
  "outcome": "success"
}